{
  "schema_name": "emrys.report_receipt",
  "schema_version": "8.0.0",
  "record_type": "report_receipt",
  "run_id": "run_fixture",
  "generated_at": "2000-01-01T00:00:05Z",
  "publication_state": "complete",
  "transaction_state": "complete",
  "interpretation_boundary": "computational_candidates_only_biological_validation_outside_emrys",
  "input_run_summary": {
    "path": "tests/fixtures/artifact_schema_v1/source/results/artifacts/run_fixture/run_fixture.run_summary.json",
    "sha256": "eeeeeeeeeeeeeeeeeeeeeeeeeeeeeeeeeeeeeeeeeeeeeeeeeeeeeeeeeeeeeeee",
    "schema_name": "emrys.run_summary",
    "schema_version": "8.0.0"
  },
  "inputs": [],
  "template": {
    "path": "emrys.reporting/templates/run_report.html.j2",
    "sha256": "ffffffffffffffffffffffffffffffffffffffffffffffffffffffffffffffff"
  },
  "stylesheet": {
    "path": "emrys.reporting/styles/run_report.css",
    "sha256": "abababababababababababababababababababababababababababababababab"
  },
  "outputs": [
    {
      "output_id": "scientific-report-html",
      "kind": "scientific_html",
      "path": "results/reports/run_fixture/run_fixture.scientific_report.html",
      "sha256": "1212121212121212121212121212121212121212121212121212121212121212",
      "size_bytes": 4096,
      "media_type": "text/html",
      "self_contained": true
    },
    {
      "output_id": "evidence-report-html",
      "kind": "evidence_html",
      "path": "results/reports/run_fixture/run_fixture.evidence_report.html",
      "sha256": "1313131313131313131313131313131313131313131313131313131313131313",
      "size_bytes": 3072,
      "media_type": "text/html",
      "self_contained": true
    }
  ],
  "state_banner": "COMPUTATIONAL RESULTS — BIOLOGICAL VALIDATION IS OUTSIDE EMRYS.",
  "schema_versions": {
    "artifact_entry": "4.0.0",
    "run_summary": "8.0.0",
    "report_receipt": "8.0.0"
  },
  "analysis_execution_performed": false,
  "external_network_assets_used": false,
  "validation_claimed": false,
  "warnings": [
    {
      "code": "synthetic_fixture",
      "message": "The report is a rendering of synthetic computational evidence.",
      "related_artifact_ids": []
    }
  ],
  "errors": [],
  "provenance": {
    "producer": "emrys.reporting.report",
    "producer_version": "7.0.0",
    "git_commit": "fixturecommit",
    "created_at": "2000-01-01T00:00:05Z",
    "installed_package": {
      "path": "/fixtures/installed/emrys",
      "distribution": "emrys-rna-workflow",
      "version": "0.0.0+fixture",
      "content_sha256": "aaaaaaaaaaaaaaaaaaaaaaaaaaaaaaaaaaaaaaaaaaaaaaaaaaaaaaaaaaaaaaaa",
      "git_commit": null,
      "git_dirty": null,
      "python_lock_sha256": "bbbbbbbbbbbbbbbbbbbbbbbbbbbbbbbbbbbbbbbbbbbbbbbbbbbbbbbbbbbbbbbb"
    }
  },
  "analysis_policy": {
    "path": "contract/primary_analysis_policy.json",
    "sha256": "4444444444444444444444444444444444444444444444444444444444444444",
    "size_bytes": 512,
    "schema_version": "emrys.analysis-module-policy.v1"
  },
  "evidence_renderer": {
    "producer": "emrys.reporting.report",
    "producer_version": "7.0.0",
    "package": "emrys",
    "content_sha256": "cccccccccccccccccccccccccccccccccccccccccccccccccccccccccccccccc",
    "template_engine": "Jinja2",
    "template_engine_version": "3.1.6"
  },
  "scientific_renderer": {
    "module_id": "emrys.paired-cmh",
    "module_version": "1",
    "distribution_name": "emrys",
    "distribution_version": "1",
    "package": "emrys.analyses.paired_cmh_candidate_ranking",
    "entry_point": "emrys.analyses.paired_cmh_candidate_ranking:analysis_module_v1",
    "content_sha256": "bbbbbbbbbbbbbbbbbbbbbbbbbbbbbbbbbbbbbbbbbbbbbbbbbbbbbbbbbbbbbbbb",
    "core_support": {
      "producer": "emrys.reporting.report",
      "producer_version": "7.0.0",
      "package": "emrys",
      "content_sha256": "cccccccccccccccccccccccccccccccccccccccccccccccccccccccccccccccc",
      "template_engine": "Jinja2",
      "template_engine_version": "3.1.6"
    }
  }
}
